<?xml version="1.0" encoding="UTF-8"?>
<!--
To change this license header, choose License Headers in Project Properties.
To change this template file, choose Tools | Templates
and open the template in the editor.
-->


<sms xmlns:xsi="http://www.w3.org/2001/XMLSchema-instance" 
 xsi:noNamespaceSchemaLocation="4.xsd">
    <from>
        <nombre telef="661560834">Antonio</nombre>
    </from>
    <to>
        <nombre telef="661560835">Carlos</nombre>
        <nombre telef="661560836">Merche</nombre>
    </to>
    <longitud>100</longitud>
    <fecha>2002-09-24</fecha>
</sms>
